{"aliases": [], "canonical_sha256": "21fbfe8b53dbcd605d79486b6b1bf9624b7ab9a4e549fb2b63c74a7344c46460", "collections": ["registry-real-v1"], "dataset_hash": "21fbfe8b53dbcd60", "display_name": "Parkinsons Telemonitoring", "files": {"meta": {"bytes": 7566, "sha256": "a509377436c726ed518b201553c47d52a66ae682923a8a17df9a3fd063610be0"}, "test": {"bytes": 259696, "columns": 22, "has_header": false, "rows": 999, "sha256": "9786badb9d822cd0dc34b730019c13feff1fd02fe85da61a59c00a27e461f61c"}, "train": {"bytes": 259938, "columns": 22, "has_header": false, "rows": 1000, "sha256": "d9a0b97e91ff9d04bc87fefa4671a49c40cee21dfac05be58a7fc7ce08045931"}}, "id": "21fbfe8b53dbcd60", "ingest": {"ingested_at": "2026-09-18T20:40:16Z", "relpath": "regression/21fbfe8b53dbcd60", "source": "quant", "tool_version": "jope-datasets/0.1.0"}, "origin": "real", "provenance": {"dataset_id": "parkinsons-telemonitoring", "dedupe_fingerprint": "a00f17f27e77d9ca8574aff6b711ada7b8b19a91", "license": {"status": "unknown"}, "platform": "uci", "retrieved_at": "2026-06-27T23:24:34+00:00", "url": "https://archive.ics.uci.edu/ml/machine-learning-databases/parkinsons/telemonitoring/parkinsons_updrs.data"}, "schema": "jope.dataset-catalog/v1", "shape": {"categorical_features": 0, "columns": 22, "features": 21, "rows": 1999}, "split": {"method": "quota stratified by target distribution plus high-variance feature quantile bins", "seed": 550427014, "test_rows": 999, "train_rows": 1000}, "target": {"index": -1, "name": "target", "type": "numeric"}, "task": "regression"}